"5835636","30101","Active","459000","Pickett's Mill","Durham","Allatoona","Stunning home w/charming frt porch, elegant entry w/formal LR w/built-ins, formal DR w/wainscot, hardwoods in all living areas, dramatic 2-story fam rm w/fp that opens to huge kitchen w/granite, island, dbl ovens, gas cooktop, walk-in pantry, mudrm area, bedrm on main, oversized mstr suite w/furniture grade vanities, upgraded tile surrounds in all baths, finished terrace lvl w/bedroom, bonus room, game room, kitchenette & storage. Great patio w/underdeck system, level front & back yards, playset. Newer exterior paint, newer roof, newer HVAC. Great n'hood & amenities!","PAIGE WALDEN","(770) 841-0866"
"5835769","30005","Active","459000","Creek View","Webb Bridge","Alpharetta","MAINTAINED TO PERFECTION IN GLENEAGLES OF WINDWARD! FABULOUS LANDSCAPED BACKYARD W/WATER FEATURE & OUTDOOR LIVING AREA! MASTER SUITE ON MAIN W/REMODELED MASTER BATH! LIGHT BRIGHT 2 STORY GRAND RM OPENS TO UPDATED GRANITE KITCHEN W/SS APPLIANCES, FIRESIDE EATING RM/KEEPING RM. 2 SPACIOUS GUEST BEDROOMS ON 2ND LVL & LG BONUS RM. 2 STORY ENTRY, LOVELY FORMAL DIN & LIVING RM. GORGEOUS REFINISHED HARDWOODS THROUGHOUT MAIN LIVING AREAS. HOME IS TURN KEY CONDITION, NO DETAIL OVERLOOKED! WON'T LAST! CHECK OUT 195 ACRE PRIVATE LAKE & WINDWARD LAKE CLUB FOR SWIM/TENNIS OPTIONS.","AMY T LYNN","(678) 488-1540"
"5836033","30363","Active","459000","Centennial Place","Inman","Grady","Something new has arrived at the Atlantic! Never before released floorplans now being offered for the first time ever! Impressive views & stunning features create a culmination of luxurious perfection. Wide plank hrdwd floors, stainless steel Kitchen Aid appliances, gas cooking, stone counter tops, double vanities, frame-less glass showers, soaking tubs, floor-ceiling windows, & spacious outdoor living. Million dollar renovations underway! Valet parking, 24-hour concierge, 24-hour security, Resort-style pool, wine cellar, game room, formal dining, library, fitness club.","Michael McLeod","(404) 606-0962"
"5835797","30040","Active","450000","Vickery Creek","Vickery Creek","West Forsyth","This beautiful, open ranch home features an updated kitchen that looks out to the Florida room and huge yard with pool. This floor plan has the master suite located on the left side of the home with a walkout to the back pool area, the center section for entertaining and cooking and the right side with secondary bedrooms. There is a bonus area upstairs as well which can be used as a bedroom or office.","MICHAEL HICKMAN","(404) 444-3446"
"5834929","30345","Active","449900","Briarlake","Henderson - Dekalb","Lakeside - Dekalb","New listing in Amberwood! This immaculate home features gorgeous, large, private fenced lot, stunning pool & huge entertaining patio. Open-plan main level includes fireplace, hardwoods, screened porch, office (currently nursery) & remodeled kitchen w/ granite counters & white shaker cabinets. Master suite has double vanities, granite counters, jetted tub, frameless shower w/ dual shower heads & deep walk-in closet. Terrace level features large living area w/ fireplace, 2 spacious bedrooms, full bath & walk-out to patio. Across from 21 acre Briarlake Park & walking trail","Monica Bosco","(678) 637-7353"
"5834972","30068","Active","449900","East Side","Dickerson","Walton","Super spacious remodeled ranch in sought after Indian Hills Country Club. Large light filled family room with wet bar. Separate den, living room, and dining room. Wide plank hickory flooring. Eat-in kitchen with deluxe cabinetry, stainless steel appliances, double oven,& separate cooktop. Elegant master suite with shiplap walls, walk-in closet,& updated bath with large shower with rainfall head. Oversized pantry. Extended garage w/ storage room, craft room,& in-ground storm shelter. Freshly painted inside & out. Top East Cobb Schools - Walton High, Dickerson, East Side.","MICHAEL SMITH","(404) 932-4389"
"5834981","30041","Active","440000","Haw Creek","Lakeside - Forsyth","South Forsyth","Fantastic opportunity in Chattahoochee River Club! Very dramatic open floor concept. Hardwoods through out the main. Beautiful dining room with wall of windows with spectacular views. Formal living room. Large kitchen with center island. Family room with fireplace with views to the kitchen. Terrace level is ready for you to finish!! Beautiful flat back yard!! Walk to schools!!","Debbie and Tara Team","(470) 253-4064"
"5836121","30115","Active","439900","Macedonia","Creekland - Cherokee","Creekview","Beautiful 5 BR 3.5 BA home on sought after street in Woodmont Golf & Tennis.  New paint!  Bedroom/Study on main floor! H/W floors through out main level! S/S appliances, glass tile backsplash, under/over cabinet lighting, and granite counters in kitchen!  Stained wood bookshelves and soaring rock fireplace in great room! Master suite features sitting area, spa like bath with Jacuzzi tub, and massive walk-in closet. Unfinished basement has 3rd HVAC and duct work plus stubbed for bath. Fenced backyard, oversized deck, wooded backyard, attached storage off garage!","BETH MCCORD","(404) 434-2970"
"5836131","30328","Active","439900","Heards Ferry","Ridgeview Charter","Riverwood International Charter","Amazing Location for this updated Home.Terrace level with the 4th Bedroom/ office/ Large Family/Game Room.Great Investment Opportunity in rising area-Mercedes Benz, DT Sandy Springs,walk to shopping,restaurants,Abernathy Greenway,close to interstates.Bring your Builders/Renovation team for your dream home in this PRIME SS Location location! Surrounded by multi-million dollar homes, perfect opportunity to tear-down or renovate in one of the most sought-after school districts you can build a large,triple-level home with extensive living space on the existing footprint.","AVA ARJMAND","(770) 842-1212"
"5836039","30363","Active","439000","Centennial Place","Inman","Grady","Something new has arrived at the Atlantic! Never before released floorplans now being offered! Impressive views & stunning features create a culmination of luxurious perfection. Wide plank hrdwd floors, SS Kitchen Aid appliances, gas cooking, stone counters, double vanities, frameless glass showers, soaking tubs, floor-to-ceiling windows & spacious outdoor living. Valet parking, 24-hour concierge & security, Resort-style pool, wine cellar, game room, formal dining, library, fitness club. Photos are representative, not of actual unit.","CINDY ALLEN","(727) 430-4084"
"5836316","30324","Active","439000","Morningside-","Inman","Grady","Beautiful light filled townhome. Open floor plan,Entrance foyer,updated Kitchen with stainless appliances, separate living with fireplace, dining room features french doors to a balcony, half bath on main floor,both bedrooms offer en suite baths,master bedroom has large walk in closet,tons of storage space throughout the house,charming private patio perfect for evening diners. Extra large one car garage with plenty of space for work area. Walkable to Piedmont Park,Beltline,3 grocery stores, gyms,restaurants, bars, Ansley Park and golf course... beautiful skyline view.","PAULA HEER","(678) 427-7194"
"5835580","30152","Active","435000","Frey","Durham","Harrison","Most popular gorgeous elevation. Very convenient master on the main. 6+ car garage. 3 on driveway level and 3 with a drive way in the rear. Front porch. Larger floor plan with over half an acre of ""level"" lot with a private backyard backing to a large horse farm. Lots of recent care making it move in ready. This home is on a large full basement, bath stubbed. Newer Roof. Close to $40,000 in improvements.","KAMBIZ PYVAND","(678) 665-1211"
"5835626","30305","Active","435000","Smith","Sutton","North Atlanta","Stunning Loft in the Heart of Buckhead! Light filled, open and spacious with gorgeous hardwood floors throughout, exposed brick, floor to ceiling windows, fresh neutral paint and fabulous views! Updated kitchen with large center island/breakfast bar, gas cook top, touchless faucet, stainless farm sink and new textured marble counter tops. Master has huge walk-in custom closet! Two gated and covered parking spaces near elevator. Great amenities include concierge, pool, gym, clubroom and roof top patio. Convenience abounds - nearby Buckhead Atlanta shops & restaurants.","MARISA H GREEN","(404) 932-9355"
"5835383","30080","Active","434900","Nickajack","Campbell","Campbell","Sought after location, gated community, clubhouse, pool & garage on the main level are the jewels in the crown of this 4 story townhouse! Welcome to an enclave of homes like none other situated in the Vinings/Smyrna area. High ceilings, refinished hardwoods, satin finish hardware, new carpet & paint, stone fireplace, deck entire width of townhouse overlooking green space with mature trees, in-law suite or nanny retreat on terrace level with full kitchen, door from the garage to the finished basement, finished fourth floor are just some more of the highlights here.","Jill Huitron","(404) 376-5114"
"5835789","30328","Active","430000","Spalding Drive","Sandy Springs","North Springs","FALL IN LOVE w/this CHARMING & UPDATED Sandy Springs Ranch! OPEN/SPACIOUS Floor Plan. Beautiful Hardwds. Updated Kitchen w/exposed brick, granite, SS/BLK Appl, LG Island w/bfst bar, + skylight. Sep Fireside FAM RM w/plantation shutters. Sep DIN RM. Great RM highlighted by exposed brick wall. Back of home is a wall of windows w/amazing natural light. Spacious MSTR including sit area, vault ceil, skylights, & priv bkyrd access. DBL Vanities in both Baths. Laundry/Mud RM. VACATION EVERYDAY in priv + fenced muli-tier bkyrd w/Salt POOL, LG deck, & prof brick/stone walkways.","Madalyn Suits","(404) 419-3550"
"5835510","30024","Active","429900","Burnette","Hull","Peachtree Ridge","Traditional 3 Side Bricks Home in Award Winning Peachtree Ridge HS in Suwanee; 5 Bedrooms, 5 Full Baths, Full Finished Basement - Largest Floor Plan in the Neighborhood - Lot of Space for a Growing Family; Open Floor Plan with 2 Story Foyer and Family Room; Double French Doors to Covered Front Porch; Spacious Kitchen w/ Island and Breakfast Area; Loft Off Master Bedroom With View of Fireside Family Room; Huge Finished Walk Out Basement; Private Backyard; cul-de-sac st; Family Friendly Nbrhd w/ ++ Amenities Backs up to the Chattahoochee * Best Price Per SQFT in Suwanee *","MING HUANG","(770) 232-9481"
"5835764","30060","Active","429900","West Side - Cobb","Marietta","Marietta","Beautiful renovated home with huge charm!  This home is the open concept home you've been looking for!  Just a short walk to the Marietta Square! Tucked away on quiet N.Forest Avenue, this total rehab has 3 bedrooms and 2 wonderfully renovated baths.  The kitchen has beautiful counter tops and a stylish backsplash.  The whole family can come enjoy a meal in the large family style eating area that flows into your kitchen.  Grill on the wonderful deck and enjoy the totally private fenced back yard.  There's bonus room attached to the carport so create your own space!","BILL BRANNEN  JR","(678) 488-1030"
"5835932","30316","Active","429000","Parkside","King","Maynard H. Jackson, Jr.","BREATHTAKING HOME CONTAINS MORE SPACE THAN SHOWING IN TAX RECORDS. HOME SITUATED ON INCREDIBLE STREET AND NEIGHBORHOOD. 2 STORY OPEN STAIRCASE LEADING TO MASSIVE GREAT ROOM DOWNSTAIRS. KITCHEN IS MAGAZINE QUALITY, HOME IS STUNNING WITH A LOT OF SITTING AREAS AND MANY SEPARATE ROOMS, MASTER BEDROOM WITH SITTING AREA PLUS SEPARATE OFFICE AND WALK IN CLOSET. THIS HOME HAS BEEN BUILT OUT AND TAX RECORDS DO NOT REFLECT IN THE SQ FT. DO NOT LET THE FRONT OF THE HOME FOOL YOU ABOUT THE SIZE, AGENTS PLEASE SEE PRIVATE REMARKS AND DO NOT USE SHOWTIME,","MITCHELL B GROOMS","(404) 386-1101"
"5836076","30092","Active","429000","Simpson","Pinckneyville","Norcross","Located in a big quite neighborhood of Preachtree Station. Walking distance to YMCA, Forum shopping mall, Jones Bridge Park (We enjoyed so much when we lived there!) MAIN FLOOR - Open floor plan, Loft ceiling in living room - Kitchen with electronic stove w/ two ovens, opens up to breakfast area and dining room - Screened and semi 4 season backyard patio overlook the blooming backyard! - Hardwood floor through the main floor except one bedroom - 1 guest bedroom for visiting inlaws UPSTAIRS - 3 bedrooms and 2 full bathrooms - Walk in closet for main bedroom","Yiling He","(770) 722-6699"
"5835094","30043","Active","425000","Jackson - Gwinnett","Northbrook","Peachtree Ridge","This is the home you have been waiting for!! Step in the front door and marvel at the light-filled 2-story foyer and wall of windows in family room. Enjoy the beautiful huge kitchen that has been renovated with all the bells and whistles and open to main level. Relax in the oversized master bedroom with sitting area. Spa-like master bath and gigantic master closet which offers the space you always dreamed of having. Be the first to call this gracious home yours!","KAREN POLAND","(678) 741-5101"
"5835141","30005","Active","425000","Shakerag","River Trail","Northview","Check out this entertainer's home. On the main level you will find a mix of carpet and hard woods. The grand entrance leads you to theLiving rm/ kitchen with granite counters and plenty of counter space to have get togethers in. The main level bedroom makes hosting visitors easy with no stairs to climb. You'll be the cool-aide home with the terrace level which is ready for your workout rm, pool table and watch movies in your home theater. At the end of the day relax in your master retreat where you will find a great tub for soaking or reading in your private sitting rm.","THOMAS CRONE","(404) 384-5409"
"5835655","30360","Active","425000","Kingsley","Peachtree","Dunwoody","Craftsmen style accents in spacious brick & frame beauty - sought-after swim tennis community - Fontainebleau. Looking for a great affordable family home in Dunwoody? This is it!  Exceptional upgrades throughout including dream terrace level, large master bath and fabulous 3-tiered deck.  Room for guests with bedroom & bath on main level!  Additional features include, separate dining room, bonus room, fireplace and large master, finished basement  with wet bar, gym and office, two car attached garage, 5-zone sprinkler system, large backyard.","MARY JO CHAMBLESS","(404) 664-6346"
"5835863","30127","Active","425000","Kemp - Cobb","Lovinggood","Hillgrove","Three sided Brick home on a fantastic lot is a must see! Chefs kitchen with granite tops,tiled backsplash,stainless steel appliances & breakfast bar with views to the Family Room that feature built-in bookcases and soaring ceilings. Main floor features a bedroom and full bath, Hardwood floors, Formal Living and Large Dining Room. Large Master Suite up and full finished basement. New Roof and HVAC. Enjoy the Screen Porch all year long. Easy access to this fantastic Swim/Tennis community that features a fishing pier,soccer fields,hiking trails. Great Cobb County Schools.","MATTHEW HENEGHAN","(770) 330-8816"
"5836577","30022","Active","425000","State Bridge Crossing","Autrey Mill","Johns Creek","Awesome five bedroom, three and a half bath, over half an acre cul-de-sac home in Johns Creek. Updated kitchen with tile floors, SS appliances and granite countertops. Full finished basement with bedroom, full bath and an office. Kitchen opens to huge family room. The large master bedroom enhanced by a cathedral ceiling. Formal dining room for family and friends gathering. Enjoy your large deck overlooking your private backyard. Great School District.","JOHN SAMUEL RUSSELL","(404) 429-9291"
"5835004","30078","Active","424900","Brookwood - Gwinnett","Alton C. Crews","Brookwood","Welcome Home to Bright Water!  Situated in the award winning Brookwood School District, this home has a lot to offer.  Three car garage? We've got it! Hardwood floors, built in bookshelves, level fenced backyard, covered porch, two story kitchen with island, formal living and dining rooms, and so much more! The unfinished basement is a blank slate waiting for your personal touch. Make an appointment today!","Jill Nunn","(678) 808-1300"
"5835847","30189","Active","424000","Bascomb","E.T. Booth","Etowah","$175,000 worth of upgrades...just like a new home!!! New hardi lank siding, windows, roof, gutters, driveway, & ductwork. New interior paint throughout and exterior paint. New hardwoods throughout main and upstairs hall and master bedroom. New light fixtures, garage doors, and 2-new HVAC units. Gorgeous updated kitchen with new soft close cabinets, under cabinet lighting, quartz countertops, new appliances with double confection ovens & new island. Master boast hardwoods, trey ceiling and sitting area. Stunning, remodeled master bath offers heated floors, new cabinets,","SARAH TERRELL","(770) 928-6525"
"5835259","30518","Active","420000","Riverside - Gwinnett","North Gwinnett","North Gwinnett","Great opportunity to get into Wild Timber! 4 bedroom, 2 1/2 bath home on unfinished basement. Main level has LR, DR, 2-story Foyer and FR with FP, and kitchen with solid surface counters and breakfast area, walk-in pantry, laundry room and powder room. Upper level has master bedroom suite with sitting area, three additional bedrooms and bathroom. Covered porch and extended deck overlook the private, fenced backyard. Newer exterior paint and roof. Neighborhood has fantastic amenities - 3 pools, tennis, clubhouse, playground and walking trails. North Gwinnett HS cluster.","TRACY BROWN","(770) 289-6354"
"5835633","30318","Active","420000","Centennial Place","Inman","Grady","Beautifully decorated and well appointed upscale condo in the trendy Westside Provisions District. This open floorplan is great for entertaining and offers direct city views of the Midtown skyline. Enjoy European/Modern finishes such as Brazilian hardwood floors, stainless steel appliances, and marble tiles in each bathroom.  Designer style decorations defines the living space and adds a touch of luxury to each room. Enjoy doorstep access to five star dining and exclusive shopping on the Westside. This is truly your live, work, play lifestyle!","Rea Kelly","(404) 428-9929"
"5835817","30548","Active","420000","Hall - Other","Hall - Other","Hall - Other","This one of a kind, ""LIKE NEW"" beauty in sought after Villages at Deaton Creek, an over 55 active adult community. Pristine 3 bdrm, 2.5ba ranch has barely been lived in & well maintained. Upgrades include HDWD flooring, granite countertops, SS appliances & tile. Bright & open floorplan w/lots of natural light. Luxurious master suite w/bdrm sized closet. One of the most desirable lots in the subdivision awards you with a private bkyard & covered patio. Gated community, has a well-appointed clubhouse, beautiful amenities & offers lots of activities. Come see for yourself.","Bonds Realty Group","(678) 269-1100"
"5835463","30040","Active","419490","Coal Mountain","North Forsyth","North Forsyth","Charleston Plan: 5/4 Beautiful Open Floor Plan. Features a Dreamy Gourmet Kitchen with SS APPLIANCES including a DOUBLE OVEN, GRANITE COUNTERS, 42"" Super-Sized Cabinets, Beautiful 5"" HARDWOOD FLOORS. Large Owner's Suite Boasts Luxurious Master Bath with Luxurious Tub, Separate Tile Shower, Dual Sinks and Huge Walk-In Closet. Large Secondary Bedrooms Nestled on Top Floor with Large Closets and a Spacious Media Room and an unfinished Basement. Ready for immediate move-in! This Home comes with the Estate Package that includes OVER $15K IN UPGRADES.","TAMRA WADE","(678) 804-2595"
"5836430","30022","Active","419000","State Bridge Crossing","Autrey Mill","Johns Creek","Spacious and well maintained home on a private professionally landscaped lot! Enjoy a ranch style home on a finished basement with valuted ceilings and a large open layout perfect for entertaining! Greeted with a wealth of natural light enjoy cooking in your very own chef's style kitchen with lots of counter space and storage. Bay windows in kitchnette look out to a big back deck and fenced yard. Finsihed space above the garage makes for a great workshop! Basement is an ideal gameroom, office space, or in-law suite!","Angel Watkins","(770) 371-4703"
"5835387","30011","Active","417000","Duncan Creek","Frank N. Osborne","Mill Creek","This home will be available in June. Located on a serenely landscaped lot, this 2-story home has 5 beds, 4 baths, and features a secondary bedroom on the main level with easy access to living spaces. • Gourmet kitchen boasts 42” white upper cabinets with stainless steel appliances, and granite countertops.• Upgraded 5&rdq...uo; hardwoods throughout main living spaces and stairs. • Choice kitchen features large walk-in pantry and butler’s pantry to maximize storage. • Master bath features separate shower and tub and two spacious walk-in closets. Swim /Tennis Amenity.","Christen Pemberton","(706) 461-4096"
"5835514","30316","Active","415500","Meadowview","McNair - Dekalb","McNair","Bring all of your ideas from Pinterest & Houzz to create your one-of-a-kind home on a full BASEMENT! Contract now to make all of your selections. Home complete in the Fall. Popular open plan with large kitchen island. High end finishes include 9 ft ceilings thru-out, hardwood floors, quartz/granite countertops, stainless appliances, fireplace in Family Room. Oversized Master has covered porch, 2 closets. Bath has freestanding tub and separate shower. Where else can you find a Community pool and playground?","CANDACE FUQUA","(770) 912-9003"
"5835653","30542","Active","415000","Spout Springs","C.W. Davis","Flowery Branch","One owner, beautifully maintained DR Horton home in cul de sac. This move in ready home offers hardwood floors, coffered ceiling, S/S appliances, granite countertops, tile backsplash w/accent and built-in desk. Master suite w/sitting room and tiled master shower. Huge deck that overlooks the walking trail great for entertaining or to enjoy a nice relaxing atmosphere. It's perfect for those looking for a low maintenance yard.","Bonds Realty Group","(678) 269-1100"
"5835780","30022","Active","414900","Ocee","Taylor Road","Chattahoochee","Perfect corner lot w/columned side porch/veranda. Extra parking/no alleyway. Painted garage flr. Interior just painted w/updated color. Full BA on main ajacent to office/living rm., large dining rm/Bulter's Pantry. Huge walk-in pantry, kitchen has large island/bar area, stainless refrigerator, double ovens, gas cooktop, microwave, dishwasher. Gas grill, washer/dryer, gas lots, plasma TV remains. Enormous master closet! Loft sitting area, laundry room and add. 2 bedooms up. Walk to pool/tennis. Walk to shopping, grovery, restaurants. Hardwoods on main.","LYNN LUSBY","(678) 643-8772"
"5835527","30316","Active","413400","Barack H. Obama","McNair - Dekalb","McNair","Bring all of your ideas from Pinterest and Houzz to design the home of your dreams on a BASEMENT! Contract now to make all of your selections. Stylish new Prairie-style home complete in the FALL. Open floorplan with large kitchen island. 9 ft ceilings on all floors. Hardwood floors, quartz/granite countertops, SS appliances, fireplace in huge Great Room! Bedroom & bath on main floor. Master has freestanding tub & sep shower. Where else do you get a Community Pool and Playground ITP?","CANDACE FUQUA","(770) 912-9003"
"5835182","30075","Active","410000","Roswell North","Crabapple","Roswell","Lake front Property in Land O Lakes, this beautiful 4 bedroom home with hardwoods through out, fresh paint inside, fabulous updated kitchen with a sunroom area that provides a tranquil view of the lake & backyard. All updated fixtures,door knobs.  The basement is a walk out unfinished area for your personal design. Large outdoor deck for entertaining and grilling out. New Heating and AC installed. This home will not last, come by soon.","MICHELLE MIRALLES","(678) 298-1600"
"5835861","30041","Active","410000","Big Creek","South Forsyth","Lambert","Rare Master on Main in Parklike Setting in Hot South Forsyth! Lambert HS! Meticulously maintained-Granite Kitchen w/gleaming white cabinets leads to Sunroom & Screened porch-Fireside Great Room-Spacious Master Bedroom with Huge Walk In Closet-Second Main Floor Bedroom & Bath-Awesome Bedroom, Bath & Loft Upstairs-Ideal for teens/guests! Massive Bsmt will be the Perfect Mancave! Serene, Fenced bkyd with lovely landscaping & Big Patio! Roof and both HVACs replaced-Don't miss the HUGE walk in attic! Community Path leads to Sharon Park-Taxes reflect senior discount","Pam K Abernathy","(404) 863-7724"
"5829040","30084","Active","409900","Midvale","Tucker","Tucker","This completely renovated ranch boasts an open floor plan w/ 5 bedrooms, 4.5 baths, finished basement & a 2-car garage! Gourmet Kitchen w/ SS appliances, custom cabinets, granite counters, & a huge island! Retreat to the master suite on the main level w/ walk-in closet, dual vanity, & custom shower. Expansive basement boasts flex spaces & a wetbar! Enjoy the outdoors year round w/ covered porch & HUGE backyard! Every detail is realized in the intentional customization of this amazing home! Minutes to Main St. Downtown Tucker, Northlake, & Henderson Park. BRILLIANT!","JONATHAN RICH","(770) 402-3957"
"5833427","30115","Active","409900","Hickory Flat - Cherokee","Rusk","Sequoyah","Fabulous Right Sized Living! The Oak Plan, same plan as our decorated model, features the Sophisticated Living you're looking for today! Must Have Master on Main with Gourmet Kitchen. Upscale 11' First Floor Ceiling Height! Luxurious Master Suite. Additional Guest Bedroom on Main. Beautiful Features Galore! Do stop by and see why we don't call this ""downsizing"", we call it ""Right Sizing""! Landscaping Included in Monthly HOA. Lock & Go Living. Ready in June. Do visit our Decorated Model for more info. INCENTIVE: FIRST 3 CONTRACTS GET $7500 TOWARD OUTDOOR LIVING!","JEANINE BLUMER","(678) 858-4927"
