"5834999","30040","Active","230000","Coal Mountain","North Forsyth","North Forsyth","Home sweet home! Listed below appraised value! Move in ready rocking chair wrap around front porch. Ready for you to enjoy! Great home with large backyard with deck for entertaining. Granite counter tops, hardwood floors, stainless steel oven/gas range. Beautiful gas fireplace for those cold winter nights. Master on main, 2 bedrooms, 1 full bath upstairs, in law suite with full bath on terrace level with room for storage. You will even find blueberries, blackberries and raspberries growing on side and back yard. Great schools, close to Hwy 400 and shopping.","Terri Willett","(678) 341-7400"
"5835063","30045","Active","230000","Pharr","Couch","Grayson","Meticulously maintained townhouse in gated community with view of the woods and the lake.  Hardwoods throughout the main level, open kitchen with granite countertops and huge island overlooking fireside family room with built in bookcases.  Upstairs is the master suite with beautiful bath and huge closet along with two secondary bedrooms.  There is also a large basement with great space are that is wired and ready to be finished.  Community is within walking distance of shopping, park and restaurants.","JUDY WITTENBERG","(404) 402-6798"
"5835963","30038","Active","229990","Browns Mill","Salem","Martin Luther King Jr","Silverstone Presents the Dewhurst plan. Traditional style home has a 2 story foyer, separate living room/study, and formal dining room. Guest Bedroom on the main level. Gourmet kitchen features granite, tiled backsplash, and 42"" cabinets. Kitchen views to fireside family room. Master bedroom has his & hers closets, marble countertops, and garden tub & shower. All secondary bdrms come with spacious closets. Laundry is upstairs! All homes include Washer, Dryer, Refrigerator, Stainless Steel Appliances, and Blinds! Wow what a deal! Hurry out! (File Photos)","TAMRA WADE","(678) 804-2595"
"5835867","30253","Active","229915","Dutchtown","Dutchtown","Dutchtown","With its covered front porch, the McPherson has a welcoming wide entry leading to a traditional dining room that's perfect for entertaining. Both the kitchen and family room live to the rear of the home, with access to the yard from the preferred kitchen area. Unexpected luxuries upstairs include a dedicated, private sitting area in the owner's suite, as well as an open loft area. Three secondary bedrooms and a full bath are all located off of the loft, as is a family-friendly laundry room.","Kevin Leonard","(404) 416-1447"
"5834381","30039","Active","229900","Centerville - Gwinnett","Shiloh","Shiloh","Beautifully Updated 2-Story Home in Swim/Tennis! Updated Kitchen w/ Granite Countertops, Tile Backsplash, Island, Breakfast Bar, & Upgraded Flooring. Open Concept from Kitchen to Breakfast Room & Family Room! Formal Living & Dining. Large Master with Gorgeous Bathroom- Glass/Tile Shower, Granite, & Tile Floors. Three Large Secondary Bedrooms and Bathroom Upstairs! Partially Finished Basement features Full Bathroom, Media/Rec room, Potential 5th Bedroom, Workshop Area, and Large Storage Room! Gorgeous Sunroom Overlooking Private, Wooded Backyard! Gwinnett County Schools!","Sarah Prouty","(678) 438-2570"
"5835041","30548","Active","229900","Duncan Creek","Frank N. Osborne","Mill Creek","Impeccably maintained open ranch with vaulted great room, banquet sized dining room, open kitchen/breakfast room plus sun room and huge covered timber framed back porch.  Tile floors in kitchen and all baths.  Master suite features trey ceiling double vanities, separate shower and tub.  Nice sized bedrooms, guest bath and large bonus room/4th bedroom.  Freshly painted and move in ready.  Spectacular fenced in large private back yard with play area.  Swim/Tennis neighborhood in sought after Mill Creek school district.","KAY CLARK","(404) 406-8504"
"5835155","30114","Active","229900","Sixes","Freedom - Cherokee","Cherokee","Charming cottage in desirable Bridgemill.  Light and bright first floor has Living Room, Family Room, Kitchen with Breakfast area. New appliances, island, plenty of storage.  Vaulted ceilings.  New carpet and fresh paint make this home move-in ready.  Two bedrooms on main level, master suite with large walk-in closet, garden tub/separate shower upstairs. Covered front porch, back patio.  Detached 2Car garage.  Bonus: Lot includes undeveloped land across the shared private drive.  See aerial view in photos.  Wired for security.  Agent/Owner.","TINA VLIET","(770) 874-9210"
"5835269","30144","Active","229900","Big Shanty/Kennesaw","Awtrey","North Cobb","Kennesaw's highly sought after Legacy Park.  DO not miss this 4 bedrooms 2.5 bath home in Great condition, Cobb County's most complete community.  This home is perfect for young family with kids, amazing parks, tennis courts, trails and more.","DERRICK DUCKWORTH","(404) 975-3450"
"5835398","30114","Active","229900","J. Knox","Teasley","Cherokee","Welcome home to this great deal in sought after River Green Community that includes pool,lighted tennis courts, and scenic walking trails. Spacious 4 bedroom 2 1/2 bath floor plan sits on a partially finished daylight basement. Home offers large deck and wooded backyard for entertaining, and a relaxing rocking chair front porch for warm summer nights. This Home includes a 2 year warranty for piece of mind.","LAURA MICALIZZI","(770) 330-1747"
"5835911","30141","Active","229900","Sam D. Panter","J.A. Dobbins","Hiram","Move-in ready, tastefully decorated home in desirable neighborhood. Professionally landscaped yard is both private & beautiful.  Two-story traditional home has entrance foyer that opens to formal living room w/French doors into large dining room. Hardwoods throughout. Upgraded kit has additional cabinets installed w/granite counters, tile flr, backsplash & pantry. Family rm has vaulted ceilings & built-in 9 ft. bookcases. Master suite w/double trey ceiling leads to bath w/granite counters & tile shower. Relax on screened porch & large deck. Bonus room in walk-out bsmnt.","BEVERLY C PADGETT","(404) 843-2500"
"5836080","30024","Active","229900","Walnut Grove - Gwinnett","Creekland - Gwinnett","Collins Hill","This home is a must see, move in ready, traditional 2 story home w/ 3 spacious Bedrooms & 2 1/2 Baths. This home has vaulted ceilings & an updated kitchen open to the family room. Lg laundry on the main level. Private fenced backyard with large patio ready to host cookouts for family & friends. Active neighborhood with swim/tennis, playground, & clubhouse. This is one you don't want to pass up!","TODD LEMOINE","(404) 310-9992"
"5835544","30152","Active","225000","Bullard","McClure","Kennesaw Mountain","A private home in  a cul de sac. Private, fenced park yard. Separate and full in law suite with a living room and a bedroom and full bath. In the main floor there is a three beds and 2 full baths. Granite counter tops in kitchen and all bathrooms. Stainless steel appliances in an open kitchen with a lot of natural light. All hardwood in the main floor while tile in the in law suite. Garage has a great and large work room that could finished or used for storage.","ADEEB MAJD","(404) 353-7924"
"5835695","30189","Active","225000","Carmel","Woodstock","Woodstock","2 miles from Downtown Woodstock!  Quiet neighborhood.  Relax on your front porch or back deck.  Spend time in your HUGE sunny AND shady FENCED backyard.  Decompress away from the kids/guests in your split-plan Master suite. Give your parent or college student their own space (with their own entry) in the basement suite.  Work on your hobbies in the 2-car garage plus workshop space WITH a sprinkler system!  Newer Roof.  All Mechanical is in great shape. All appliances plus washer/dryer remain. You'll have a spacious, wonderful home with just a few cosmetic updates.","J MICHAEL STANLEY","(404) 964-6623"
"5835766","30517","Active","225000","Bramlett","Russell","Winder-Barrow","Fabulous, Immaculate, Master on Main floor plan. (2nd bedrooms are gigantic) All bedrooms have walk-in closets. Large bonus loft area. Upgrades include hardwood floors, granite, newer carpet in master bedroom, professionally landscaped backyard. Come see this perfect home - swim/tennis neighborhood, close to new hospital, I-85 & Chateau Elan.","MARCI FARRELL","(770) 639-3550"
"5835631","30101","Active","224900","Baker","Barber","North Cobb","Beautiful Master on the Main plan with open floor plan. Completely updated with Hardwood Floors, Chef's Kitchen with Granite, SS Appliances, Breakfast Room and Breakfast Bar all open to the Fireside Great Room. Separate Living and Dining Room.  Huge Master Bedroom features separate Sitting Room with Fireplace. Private Fenced Backyard Oasis with  Outdoor Living with Flagstone Fireplace and Sitting Area, Exterior Lighting and Outdoor Speakers. New Hot Water Heater, Roof 5 years old, Ac unit 2 years old.","PAMELA MCINTOSH","(770) 656-0794"
"5836147","30062","Active","224500","Mountain View - Cobb","Simpson","Sprayberry","Awesome updated Ranch in great East Cobb location, conveniently located off Post Oak Tritt near Sandy Plains! Updates include new Roof, water heater, carpet, wood flooring in kitchen, fresh interior paint throughout, SS appliances in kitchen, all updated within last few years! Open floor plan with vaulted ceilings in family room.  Master bedroom is huge with his & her closets.  Very quiet, culdesac lot, with private backyard and storage building.  This home is move in ready!  Hurry, this one will not last!","TRACY ARCHER","(770) 315-2955"
"5835781","30127","Active","223000","Varner","Tapp","McEachern","Beautiful, Quiet Established Community. Formal Dining Room and Study! Kitchen w/ Breakfast bar is open w/ view to Backyard.  Largest lot in the neighborhood! Fenced yard! Private Patio! Tile on Main floor.  Washer, Dryer and refrigerator Remain. Play set to Remain. Transferable Termite Bond w/ Terminix just renewed.","ROXIE HERNANDEZ","(678) 287-4900"
"5836465","30132","Active","222000","WC Abney","Lena Mae Moses","East Paulding","Pride of ownership abounds in this magnificent home. Impeccably maintained with many upgraded features. Enjoy entertaining or simply retreat in the private, wooded and fenced backyard. Grill out on the multiple decks, patios and large gazebo. Two storage buildings. Large kitchen features many upgrades incl pull-outs for easy access. Comfortable master suite with dual sinks, garden tub and shower. Cozy great room with stone fireplace. Downstairs is a full guest suite/forth bedroom, media room and office/exercise room. Tons of storage.","Robby Rankin","(770) 434-0697"
"5835937","30349","Active","220990","Lee","Camp Creek","Westlake","Richland floor plan is a 4 bedroom 2 1/2 bath huge home!Oh my gosh everything is supersized.The formal dining room bigger, the formal living rooms bigger, the kitchen bigger, the secondary bedrooms, yes are bigger.The foyer entrance has a presidential red carpet hallway that lead to the family room.You got to see this home. Please text me at 678.718.5202 or email me at JWest2@drhorton.com so I can send you the video tour of home; then you and your client can see for yourself before coming to write the contract. This is a *Stock photo*.","JOEL WEST","(678) 718-5202"
"5835472","30308","Active","220000","Hope-Hill","Inman","Grady","Intown two bedroom two bathroom move-in ready top floor condo in Prime Location with a seller enhanced kitchen to add additional counter and multiple cabinets.  Two covered parking spots,  wall to wall carpet, balcony overlooking motor court and on the quiet side of the building.  Raised ceilings enhance to feel and have the condo feeling much larger.  Complex has deluxe pool, gym and membership room.","BRADFORD SMITH","(404) 874-0300"
"5835492","30084","Active","220000","Brockett","Tucker","Tucker","Beautiful ranch home in a cul-de-sac with lots of upgrades in the Edinburgh Estates subdivision: Bamboo flooring, granite counter tops, new water heater, newer HVAC condenser and evaporator, light dimmers, custom paint, upgraded bathrooms and many more features. 3 full bedrooms and two full baths. Level lot with a fenced yard. Close to the CDC, Emory and downtown. Separate dining room and breakfast area. Large pantry with custom shelving for extra space. Move-in ready.","Andy Bloch","(678) 672-9956"
"5835124","30084","Active","219900","Midvale","Tucker","Tucker","Maintained, move-in ready and your own personal soccer field?  Addition of family room with hardwood floors and fireplace with brick from floor to ceiling not reflected in tax record square footage.  Newer thermal pane windows throughout.  Kitchen includes breakfast bar and breakfast area.  Walk-in laundry room located near kitchen doubles as pantry.  Hall bath is a combination half bath and full bath.  Master bath with jetted tub, separate tiled shower and walk in closet.  Entertaining wrap around deck off family room.  Workshop with electricity plus covered area.","LISA E SCHIMMING","(678) 938-6573"
"5835621","30115","Active","219900","Indian Knoll","Rusk","Sequoyah","Welcome Home to this ONE Level well maintained home with large fenced yard and workshop!  Private backyard with view of pasture is great for the family/kids! 3 bedrooms/2 baths finished terrace level with huge family room and add'l room that could be used for a 4th bedroom/office/bonus room! Formal Dining Room, Covered Deck area w/add'l extra large deck for entertaining! Lots of storage and a 24X24 workshop! Side entry garage! No HOA and close to the New Northside/Cherokee Hospital, downtown Canton/shops/restaurants! Privacy, Value & great schools this home has it all!","AMY WALKER","(404) 819-8016"
"5835801","30052","Active","219900","Trip","Gwinnett - Other","Grayson","NEWLY REMODELLED SPACIOUS 4 BD 2.5 BATH HOUSE IN A QUIET NEIGHBORHOOD IN SOUGHT AFTER GRAYSON HS DISTRICT. KITCHEN WITH NEW GRANITE AND GLASS BACKSPLASH WITH OPEN VIEW TO FAMILY ROOM. NEW HARDWOOD FLOOR THROUGH OUT MAIN LEVEL. NEW CARPET. NEW INTERIOR/DECK PAINTING WITH NEUTRAL COLOR. BRICK FRONT WITH ROCKING CHAIR FRONT PORCH. NICE LARGE FENCED BACKYARD IS PRIVATE. FULL DAYLIGHT BASEMENT IS BATH STUBBED AND WAITING FOR YOUR FINISH. FORMAL LIVING AND DINING ROOM. CONVENIENT TO SHOPPING, SCHOOLS AND IN CLOSE PROXIMITY TO Vines Botanical Gardens.","LONG TANG","(404) 538-8341"
"5836002","30134","Active","219900","Connie Dugan","Irma C. Austin","South Paulding","Beautiful home with big private bkyd that goes back to creek. Leaded glass front door opens to 2 story foyer w/hdwd floors. Spacious family rm has stone FP w/gas logs. Kitchen offers granite counters, stainless appliances, & tile backsplash. Formal dining rm. Sep laundry rm. Master st on main w/trey ceiling, lg vanity, sep gdn tub, tile shwr. 3 bdrms + bonus for possible bdrm/office/etc upstairs. Oversized deck, 2 car garage & parking pad for extra vehicle/RV/boat. Desirable floor plan, nice upgrades, 2 step entry and fantastic yard. Immaculate inside and out.  Hurry!","Rhonda Bowman","(770) 639-5783"
"5836100","30032","Active","219900","Dekalb - Other","Dekalb - Other","Dekalb - Other","AMAZING HOME ON FULL UNFINSHED BASEMENT IN HOT DECATUR, MINUTES FROM EAST LAKE, DOWNTOWN DECATUR, KIRKWOOD & ATL. FANTASTIC RENOVATION W/ CHEF'S KITCHEN INCL/ GRANITE COUNTERTOP & DESIGNER BACKSPLASH, CUSTOM KITCHEN CABINETS, SS APPLIANCES INC/ FRIDGE, MASTER BEDROOM HAS HUGE CLOSET, MASTER BATH W/ DOUBLE VANITY, CUSTOM CABINET AND ENCLOSED FRAMED SHOWER DOOR, DESIGNER FAUCETS. SCREENED PORCH FOR ENTERTAINING, HUGE DECK AND FENCED YARD W/ PRIVACY WOODEN FENCE. NEW ROOF, NEW PLUMBING, NEW ELECTRIC, NEW HVAC & FURNACE, NEW APPLIANCES, ORIGINAL GORGEOUS HARDWOOD FLOORS","NATHALIE APTEKER","(404) 514-7054"
"5835360","30318","Active","218950","Rivers","Sutton","North Atlanta","INVESTORS DREAM/INVESTORS/BUYERS! SPACIOUS 2BEDROOMS/3 BATHROOMS TOWNHOUSE FOR SALE! THIS TOWNHOME IS NESTED IN THE QUIET COURTYARD SECTION OF OAK AT DEFOOR IN MIDTOWN ATLANTA. TENANT OCCUPIED RECENTLY FOR A TWO YEARS LEASE! INCOME STREAM IS $1400/MTH! LIKE NEW! TOTALLY RENOVATED! NEW PAINT, NEW CARPETS IN BOTH BEDROOMS! NEW HARDWOOD FLRS, SEPARATE DINING RM, SEPARATE LIVING RM, FIREPLACE, NEW GAS WATER HEATED, PRIVATE BACKYARD, WASHER/DRYER AND ALL APPLIANCES INCLUDED... A MUST SEE!!","COSMAS KANYI","(404) 963-8519"
"5835541","30319","Active","217900","Montgomery","Chamblee","Chamblee Charter","Lovely 2 bedroom 2 bath with SUPER easy access!  Two deeded parking spaces are almost right outside your door!   Ideal for the busy professional! Luxury amenities include great outdoor pool area, clubhouse, theater, billiard room, business center, pet walk and on site management staff. Amazing location, walk to the best restaurants and shopping in town.","Becca Phillips","(404) 450-0460"
"5835556","30008","Active","215000","Birney","Smitha","Osborne","Breathtaking Luxury Renovation in Marietta! This lovely 3BR/2.5 Bath is decked out with a Gourmet Kitchen, featuring new SS appliances; Granite Countertops; Kitchen Island; and subway tile backsplash. The home boasts a brand new neutral paint job; top quality laminate flooring throughout; new HVAC system; & updated brush nickel fixtures.   The Great Room opens to the kitchen and connects to the spacious formal dinning room and backyard, perfect for entertaining!  Home has an open floor plan, exceptionally high ceilings & tons of natural light. Convenient location!","NATTALIE de la Mothe","(678) 270-7127"
"5836111","30004","Active","215000","Brandywine","DeSana","South Forsyth","Location! Location! Gorgeous 2 bedroom 2 1/2 bath Town-home located in Forsyth County with a Alpharetta address! Beautifully decorated, wood floors, granite,  new paint and so much more!  Excellent schools ! Just 1 1/2miles to Ga. 400 and 1/2 mile to Hwy 9 !","BETH MOSS","(678) 618-4462"
"5836136","30114","Active","215000","J. Knox","Teasley","Cherokee","Hurry! Walk to the lake! Relax on your own private acre lot, enjoy the rocking chair front porch, & multi-level deck - outdoor retreat at home. Roof less than 1-year old & a brand new HVAC system. Additional covered parking, hardwood floors, butcher block counter-tops, finished bonus room and plenty of storage in basement! Don't miss this hideaway at such a great price and location.","JUSTIN TROTTER","(678) 467-7191"
"5835020","30507","Active","210285","Gainesville Exploration Academy","Gainesville","Gainesville","Move In Ready August 2017. The Cochran Plan. You'll be greeted by the Cochran with a covered front porch entry that opens to a welcoming dining room.Expansive sight lines across the back of the home connect the family room, café and kitchen areas. Four upstairs bedrooms include an owner's suite with dual walk-in closets. Laundry room and a compartmentalized secondary bath with marble counters complete the package. Built by: Smith Douglas Homes.","Linda Cothern","(678) 773-0497"
"5835782","30043","Active","210000","Taylor - Gwinnett","Creekland - Gwinnett","Collins Hill","MUST SEE ,BEAUTIFUL HOME.LIVE ,PLAY AND GROW .THIS HOME COMES WITH 3 BEDROOMS AND 3 BATHS ON MAIN FLOOR **BOUNES ROOM DOWNSTARIRS WITH FULL BATH.**THIS TRADITIONAL HOME FEATURES WHITE CABINETS IN THE KITCHEN WITH NICE BREAKFEST AREA AND TILE THROUGH OUT KITCHEN.HIGH CEILINGS IN THE FAMILY ROOM AND HARDWOOD FLOORS.MASTERBEDROOM WITH WALK IN CLOSET AND SPACIOUS BATH,SEPARATE  SHOWER AND SOAKING TUB.iNCLUDES LARGE YARD AND BEAUTIFUL DECK AND COUNTS WITH NEW ROOF AND MANY NEW FEATURES. LOCATED IN COLLINS HILL HIGH SCHOOL. THIS IS A MUST SEE!!!!","Nidia Guzman","(770) 378-4415"
"5835840","30066","Active","210000","Keheley","McCleskey","Kell","MOVE-IN Ready Home in ideal location. The entry foyer leads you into a spacious great room featuring a contemporary fireplace surround as the focal point. The formal dining room is found off of the fully updated kitchen boasting stainless steel appliances and new cabinetry. A roomy and relaxing screened porch is off the kitchen looking onto the large fully fenced backyard. New baths, lighting and neutral colors throughout. Finished rec room in the basement and an oversizd 2 car garage complete this perfectly well-maintained home. Electric stove can convert to gas.","ALLISON MAZA","(404) 403-7614"
"5835875","30080","Active","210000","Smyrna","Campbell","Campbell","The home you've been waiting for in the Heart of Smyrna! One one owner! Largest Floorplan with 2 Master Size Suites with Custom Closets plus one additional upstairs BR that can be used as an office or guest! Custom upgraded cabinets and granite! Stainless appliances! Plantation shutters! Hardwood Floors on Main Level! New Carpet Up! Fireplace! Just minutes to Suntrust Park, Smyrna Village and Silver Comet Trail! Walk to Rev Coffee on bright sunny mornings! 2-car garage with room for storage! Swimming Pool in community! **ASK about the secret compartment in the Kitchen!","LAURA JOSEL","(404) 210-0844"
"5835196","30542","Active","209990","Chestnut Mountain","C.W. Davis","Flowery Branch","Spacious 3BR/2BA Ranch with Finished Bonus Rm over Garage - Possible 4th Bd/Media Rm/Office. On an acre lot in a sought after Flowery Branch. Open floor pl, Kitchen w/ glass tile back-splash & SS Appliances. Great rm, Kitchen, Dining rm and Master Bd w/Vaulted ceiling. Large master bd and spacious master bth. Bay window in large Breakfast Nk overlooking spacious fenced backyard. Beautiful Landscape-Peach/Plum Tree, Rose Bushes, Weeping Cherry Tree. Minutes to I-85, I-985, convenient to Lake Lanier, & Chateau Elan Winery. More Pics to be added ASAP!","Richard Welch","(770) 495-5050"
"5835439","30080","Active","209900","Teasley","Campbell","Campbell","MUST SEE THIS RENOVATED RANCH IN THE HEART OF SMYRNA!3BED/2BATH W/NEW FLOORS THROUGHOUT& FRESH PAINT. SEPARATE KITCHEN THATS BEEN RENOVATED W/GRANITE AND BLACK APPLIANCES OPEN LIVING AREA TO KITCHEN NOOK. NEWER WINDOWS, ROOF, AND HOT WATER HEATER. LARGE LEVEL BACK YARD W/DECK GREAT FOR ENTERTAINING,PETS AND KIDS. ONE CAR GARAGE WITH AMPLE DRIVEWAY PARKING. MINUTES TO SHOPPING, DINING, AND 1-285! THIS IS A MUST SEE! MOVE IN READY! WONT LAST LONG!","AMANDA VANWINKLE","(678) 923-7323"
"5835567","30106","Active","209000","Russell - Cobb","Floyd","South Cobb","JUST TOTALLY RENOVATED WITH NEW AC UNIT,BAMBO HARDWOODS, GRANTIE, KITCHEN CABINETS, FAUCETS, PAINT, CARPET, STAINLESS STEEL APPLIANCES, DOUBLE VANITIES IN BOTH UPPER BATHS, TILE BATHS, CEILING FANS, LIGHT FIXTURES AND NEWER ROOF. THE DOUBLE DECK OVERLOOKS PRIVATE WOODED BACK YARD. ALL BEDROOMS NICE SIZE, PLENTY ROOM FOR A LARGE FAMILY. THIS WILL NOT LAST LONG. HOME WARRANTY NEGOTIABLE.","SHARON SIMS","(678) 231-1987"
"5835551","30309","Active","208000","Springdale Park","Inman","Grady","BEST bargain in Midtown 1/1 on the 9th level Handsome rich hardwood throughout Freshly painted Tiled floors in kitchen and bath Large garden tub/shower combo Washer/dryer included Spacious living/dining area Closet system to maximize storage Large, walk out, covered balcony with views of the Buckhead skyline and Piedmont Park THE best amenities - clubroom w/kitchen, weight room, cardio center (all state of the art) yoga room, his/her sauna indoor heated lap pool, outdoor pool, grill area, dog walk, roof top terrace, 24/7 concierge XTRA storage available Walk to Beltline","Kurt Harvell","(404) 247-8555"
"5835808","30039","Active","208000","Norton","Snellville","South Gwinnett","Awesome Swim Community. Well maintained beautiful ranch on full unfinished basement. All rooms are formulated and there is a stub for a bath. Spacious master has trey ceiling and nice walk in closet. Nice split bedroom plan is ideal for over night guests. Very open vaulted family room with gas log fireplace. Elegant formal living room and separate formal dining. Beautifully landscaped lawn. Roof and HVAC only 4 years old.","CHERYL G BROCK","(404) 843-2500"
"5835343","30141","Active","206760","Hiram","P.B. Ritch","Hiram","HARMONY CREEK -UNDER CONSTRUCTION- Beautiful community nestled in Hiram, minutes from major retailers, dining, entertainment and more! The BRENTWOOD features an open concept with view of kitchen, breakfast area and family room. Master features his/hers closets, garden tub, sep shower and double vanity.  Photos and/or renderings are representative, not of the actual property.  Est comp. date is late May 2017.","KAREL ANGUS","(404) 771-8435"
"5827894","30126","Active","205000","Mableton","Floyd","South Cobb","Beautiful updated, spacious 4-sided brick home, near shopping, Silver Comet Tr & on cul-de-sac. Family room w fireplace has open view to stunning kitchen w dbl ovens, built in dbl pantry, counter topstove, plus upgraded faucets, hardware/fans throughout. Lg fenced backyard, great for entertaining along w family room leading to the kitchen. Upgraded hardware and hardwood floors enhance the large downstairs rooms. Decorative tiled bathrooms & tiled kitchen back splash are upgraded. Master is on main. Large bedrooms upstairs. This beauty won't last. Interior being painted.","PATRICIA BRAITHWAITE","(770) 265-9323"
"5835373","30157","Active","205000","Lillian C. Poole","Herschel Jones","Paulding County","This meticulously maintained 4 Bedroom, 3 Bath Ranch Brick Front Home sits on a Full Daylight Basement.  There is a brick gas-logged firepalce in the the family room which boasts high ceilings and has a separate keeping room.  The large kitchen comes with all of the appliances and a generously sized breakfast area which leades to an enclosed sunroom and deck.   The Master Bedroom is on the main level and it has it own separate sitting room. Well maintained and professionally landscaped yard. Full finished basement with one bedroom, full bath and kitchen area.","CAROL MURRAY","(770) 719-9369"
