"5835440","30024","Active","319000","Roberts","North Gwinnett","North Gwinnett","Nestled on a Cul-De-Sac, this beautiful and cozy 4 bedroom, 2&1/2 bath home is in the one and only Suwanee. Very quite and relaxing neighborhood, open front porch for your afternoon outdoors rocking chair time, private backyard. Has hardwood floors, 2 story foyer, large master suite. Great school district in the sought after North Gwinnett High, 7 minutes to Mall of Georgia, and 3 minutes to great parks such George Pierce  and Suwanee Town park with its unique restaurants and small boutiques. New roof and exterior painting. Very convenient location.  Won't last long,","AZZA BARHOMA","(404) 944-1178"
"5835570","30349","Active","319000","Stonewall Tell","Sandtown","Westlake","Home occupied with tenant contact Agent only.Showing by appointment only.  lovable well maintained 3 sided brick solid foundation, on full basement 1601 square ft. Basement 2bds full Master size bath with sep.shower,sink,whirlpool tub.above level has bedroom on main attached bath, 9ft entry foyer, sep.dinning ,breakfast area, formal living area sep. family area.Upstairs , 4bds master bath,full jack-n-jill bath. 3 miles to Airport, plenty shopping,dinning, entertainment. Owner Licensed Agent  Bring all reasonable offers.","AUDREY SUMMEROUR","(404) 843-2500"
"5835320","30363","Active","318000","Centennial Place","Inman","Grady","Leasing Permit Available! Picture perfect views at Twelve Atlantic Station from the floor-to-ceiling windows in each room. Enjoy new hardwood floors in the living area and an open concept floor plan. Kitchen features granite countertops and a curved breakfast bar with lighter granite, stainless appliances and views! Great roommate floor plan with bedrooms on either side of living space. Master w/ windows on two sides & bath features glass door to shower, walk-in closet and closet system. Prewired for speakers, new water heater, built-in desk with granite top.","SHIRA COHEN","(678) 523-0757"
"5836042","30114","Active","317500","Canton","Teasley","Cherokee","Popular Indigo floorplan featuring 2 Bedrooms/2 Baths plus a study! Newly painted inside and out, upgraded cabinets, brand new carpet in both bedrooms, fireplace, upgraded Kitchen, surround sound in Living Room, private backyard and so much more!","Anthony G Weber","(678) 575-6704"
"5835502","30008","Active","316900","Dowell","Smitha","Osborne","LOT 1 - THE WOODBROOK D with 3 car garage. This spacious 4 BR/2.5 bath home is well designed and loaded with the impressive features Leland Homes is known for. The open concept main level offers a formal dining room, and a stunning centerpiece kitchen with oversized island that flows into an informal eating area and cozy family room. Deluxe trim package. Luxurious owner's retreat w/ glamour bath. Granite countertops in kitchen & master. Stainless appliances. PHOTOS ARE OF SAME PLAN AS BUILT ON LOT 9 - SOME UPGRADES SHOWN NOT INCLUDED IN LIST PRICE / FEATURES WILL VARY.","TERRI SCHREWS","(770) 286-3947"
"5834642","30019","Active","315000","Puckett's Mill","Frank N. Osborne","Mill Creek","GORGEOUS HOME FEATURES LARGE LEVEL LOT, OVER-SIZED MASTER AND LARGE BEDROOMS, METICULOUSLY MAINTAINED.  LARGE KITCHEN WITH GRANITE COUNTER-TOPS AND STAINLESS APPLIANCES PLUS FORMAL DINING AND LIVING AREA.  FENCED IN BACK YARD WITH GARDEN BUILDING.  WALK YOUR CHILDREN TO SCHOOL.  EXCELLENT LOCATION CLOSE TO 85/985/MALL OF GA./COOLRAY FIELD AND RABBIT HILL PARK.","Todd Twiddy","(678) 318-5000"
"5835076","30115","Active","315000","Avery","Creekland - Cherokee","Creekview","Meticulously maintained, ranch style home in sought after Creekview HS district. Hardwood floors and open floorplan with separate dining and living rooms. Kitchen with stain cabinets, corian countertops, island, double ovens, ss appliances, with bkfst bar opening to the great room and bkst area that overlooks the deck and backyard. 4th bedroom/bonus room upstairs. Mstr bath with garden tub, vaulted ceilings, tile floors. Large fenced backyard with deck that is great for entertaining. Great family amenities with swim, tennis, and playground.","Jeff Johnson","(770) 314-0870"
"5835566","30062","Active","315000","Mountain View - Cobb","Simpson","Sprayberry","Master on the main in sought after Mountain View Elementary School. Great East Cobb location close to shopping, churches, restaurants and the new Mount Bethel Christian Academy. Very open and bright home with two story great room with fireplace. Kitchen has granite counter tops. Nice subdivision, great location and available for quick occupancy.","LUKE G DOLLAR","(404) 271-7749"
"5836242","30620","Active","315000","Kennedy","Westside - Barrow","Apalachee","Absolutely Pristine Home strategically located close to excellent shopping & dining. 5 Bedroom, 3 1/2 Bath, with 3 levels of customed finished living. Features on the main cathedral ceiling living room, Master spa suite, 1/2 bath, large eat in kitchen with adjoining vaulted ceiling family room, laundry room, Formal Dining room and large deck overlooking private level back yard. Upstairs features 3 Bedrooms and large Jack & Jill Bath. Terrace level Features Finished Basement with all the extra's money can buy. Great neighborhood NO HOA Dues!!! Assumable Loan is @ 3.8%","MARVIN SLOAN","(404) 569-0125"
"5835866","30331","Active","312990","Stonewall Tell","Sandtown","Westlake","Our newest ranch plan is in high demand boasting high ceilings in the family room open to gourmet kitchen accented with stainless steel appliances, large master bedroom w/ covered patio access, sizable secondary bedrooms and so much more all nestled in the beautiful rolling hills of Bedford Estates overlooking picturesque South Fulton! * photos or renderings are representative, not of the actual property”.","KELLY WILLIAMS","(770) 875-0994"
"5835883","30214","Active","310145","Cleveland - Fayette","Flat Rock","Sandy Creek","River Park offers 3 sides brick side entry homes on acre+ homesites minutes to Fayette Pavilion and with easy access to Downtown Atlanta. Open the door to coffered ceilings, arched passageways, iron rail spindles, handscraped hardwoods and expansive kitchens with granite and Travertine. The Marlene plan is an open concept ranch with private suite and full bath up. Model home open daily! Visit builder website for contact information. Stock Photos","LORI FLOYD","(678) 509-0555"
"5835405","30062","Active","310000","Murdock","Dodgen","Pope","Gorgeous Brick Ranch in Pope school district! Totally Renovated with new hardwood flooring, paint, fixtures, vanities, cabinets, stone countertops and SS appliances. Very open floor plan with views to kitchen, family room and dining area. Huge living area with oversized island and newly painted fireplace. Full, finished basement with bedroom and bath perfect for inlaws or extra storage! Deck overlooks huge yard. Brand new roof! This is a must see!","COURTNEY NEWTON","(770) 627-3963"
"5835897","30064","Active","310000","Cheatham Hill","Lovinggood","Hillgrove","Beautiful Brick front home with renovated kitchen with granite countertops having direct view of the family room and dining room. Family room and kitchen also have direct view and access to the beautiful swimming pool with recently new pipes. Relax in the screened in back porch as well as sit by the fire in the huge sitting room in the Master bedroom that also has two walkin closets. Hardwood floors thoughout home. New heating and air units over last couple years as well as a new roof and gutters with guard.","Christopher Trice","(770) 789-5457"
"5835993","30501","Active","310000","Enota Multiple Intelligences Academy","Gainesville","Gainesville","Just a stones throw away from Northeast Georgia Medical and Brenau University.This spacious 3/2 ranch home with a full unfinished basement features hardwood floors in the living areas, granite counters and stunning solid wood cabinets.Separate cook-top and double ovens make this kitchen a cooks dream.Turn the private wooded backyard or deck into your own personal oasis.The basement is stubbed for plumbing and all duct-work is tucked into the rafters,so finished it you have nearly 9 foot ceilings.Check out the interactive 3D Virtual Tour!","EDWARD REID","(678) 546-7387"
"5835136","30157","Active","309975","Roland W. Russom","East Paulding","East Paulding","Thirty days from finished!  Great starter home in this incredible swim/tennis community!  Five bedroom, Master with a sitting room and a loft area as a bonus!  Incredible finishes troughout, coffered ceiling, trim, granite, hardwoods.  Amenities include gorgeous clubhouse, olympic size pool with waterpark size slide and splash pad, cabana, tennis courts, dog park, playground and more.","KAREN POWERS","(770) 262-0444"
"5835046","30127","Active","309900","Kemp - Cobb","Lost Mountain","Hillgrove","Gracious Ranch living with 1(small) step entry from Garage and Front door.  Open floorplan with high ceilings.  Keeping room off kitchen with fireplace, Master has large sitting room. Abundant  natural light.  Secondary bedrooms share Jack and Jill Bath.  Back yard is fenced and private. Hardwoods everywhere except in Bedrooms.  Well Maintained home.","Larry Southern","(678) 819-9260"
"5836782","30060","Active","309000","Russell - Cobb","Floyd","Osborne","","Delphine Lee","(404) 849-0562"
"5834217","30062","Active","308888","Kincaid","Simpson","Sprayberry","Welcome home to this retreat with an east facing lake view from screened porch connected to family room also from two out of the three bedrooms upstairs. Stone/hardiplank exterior with light filled interior, plush carpet and new flooring in family room and basement. The master featuring his/hers closet, a bonus room with french door currently used as a closet but could convert to a nursery, double trayed ceiling and a spa bath. The finished basement opens up to a great room and walks out to a beautiful lake in your own backyard.","Cindy Yitze Fon","(404) 333-3610"
"5835649","30080","Active","307000","Smyrna","Campbell","Campbell","Live the Village Life. Walk to restaurants, pubs, libarary, park, salon, or gym. Grab a morning latte or afternoon gelato at the Italian shop in the village. Walk across the street to the grocery store. Enjoy summer concerts and festivals on the green. Open the French doors and enjoy the weather and activity below. An ambitious walk to the Braves game. Everything has been freshly painted even the garage floor. Counters and floors have been refinished. Move in ready! This is home for those who enjoy an active lifestyle.","Robby Rankin","(770) 434-0697"
"5835283","30157","Active","305670","C.A. Roberts","East Paulding","East Paulding","Beauty abounds at Azalea Lakes Subdv! Master on main plan featuring 4 bd, 2.5 bath , high end finishes incl wide planked flrs in foyer, family rm, kit & brkfst area. SS appliances, granite and island complete the kitchen. Large master suite boasts generous bath w/tile floor & tile shower, marble vanity & huge closet! Azalea Lake's is minutes to top Paulding schools, shopping & dining, as well as, Lake Allatoona.","DAWN BROOKS","(678) 819-9260"
"5836503","30038","Active","305000","Browns Mill","Salem","Martin Luther King Jr","Beautiful home offers it all! Welcoming foyer separates the sitting & dining room, family room has 19 ft ceiling fan.  Gourmet kitchen has tons of features, large island, granite countertops, walk-in pantry, with a computer nook. Large bedroom w/full bath on main floor. Upstairs, 4 bedrooms & 3 additional full baths. Master Suite boasts has a trey ceiling, his/her closets, his/her vanity, huge jetted tub. Back deck overlooks a park like setting w/creek. Also a unfinished basement! Call Realtor to schedule a showing! OWNER OCCUPIED.  HOME QUALIFIES FOR 100% FINANCING","BARBARA DYER","(404) 564-9546"
"5835692","30062","Active","300900","Murdock","Dodgen","Pope","4 full bedrooms, much larger than it looks. Updated kitchen, newer carpet. Solid surface kitchen counters. Back room used as a recreation room but could be workshop or workout room. Fenced LARGE yard. Plenty of room for a garden! Well maintained home. Separate formal living room, separate dining room, kitchen, separate den/family room.  Possible LP  Gate in fenced back yard to Elem School.","WILLIAM R BORDEN","(770) 405-0445"
"5835069","30115","Active","300705","Hickory Flat - Cherokee","Rusk","Sequoyah","Beautiful 2 story home in the fast growing Canton/Holly Srpings area. Enjoy a neighborhood cabana, swimming pool and playground for the kids. Directly across the street from sought after schools. Easy access to Milton, Alpharetta and downtown Woodstock.  The Mercer floor plan features a 4 foot gathering room extension and daylit sunroom.  A large planning center is great for daily tasks or homework.  Granite counter tops are in the kitchen and one will enjoy a nice sitting area in the owners suite.  Casual living in the upstairs loft.","MARK SPAIN","(770) 886-9000"
"5835118","30107","Active","300000","Ball Ground","Creekland - Cherokee","Creekview","Your own little piece of Cherokee County heaven! 3 bedrooms, 3.5 baths on fabulous 2.8 acre wooded lot.  Kitchen opens to great room.  Master on main with a fabulous sun porch off of it. Great room accesses large deck, perfect for outdoor living.  Imagine the possibilities!  Upstairs are two comfortably-sized private suites AND a bonus room!  Back staircase down to the laundry room. It's hidden behind one of the built-ins next to fireplace! The unfinished basement is ready for sheet rock! Great covered patio. Large storage building and parking for your RV! Firepit area.","Kathy Ray","(678) 602-1584"
"5835726","30078","Active","300000","Magill","Grace Snell","South Gwinnett","Full Brick Ranch on the 18th Tee of Summit Chase Country Club Golf Course! Mature Landscape on 2.21 acres of peacefulness. Sunroom has beautiful view of the course. Private, shaded cul de sac lot. Extra wide hallways & doors. One step entry. Large Master Suite, double vanities and tile in all 3 bathrooms, hardwood floors, newer appliances, Corian counters, & solid wood cabinets in Kitchen. Storage Room off the garage, huge laundry room with space to do crafts! Newer roof, New HVAC exterior units. One owner, VERY well maintained home in an active Country Club Community","Mary Beth Rutledge","(678) 516-0816"
"5836084","30080","Active","300000","Smyrna","Campbell","Campbell","HOLY SMOKES!! LOCATION (walk to Smyrna Market Village) AND TRICKED OUT!! WIDE OPEN floorplan (largest in hood). NEW granite and backsplash in popular colors adorn the chef's kitchen. NEW stainless steel appliances. BRAND NEW ROOF!! Water heater nearly NEW.  Exterior paint summer 15. HARDWOODS throughout the main. Exquisite trim detail at this price point. A master bedroom fit for a king and queen with trey ceilings and a separate sitting room. Spacious secondary bedrooms. Fully fenced yard big enough to play but not too big to maintain!! Did I mention WALK TO SMV?","DAVID NABORS","(770) 329-5570"
"5834973","30307","Active","299900","Lin","Inman","Grady","Stunning & rarely available, sun-drenched loft in sought after Pickle Factory Lofts!  True Loft living with impeccable detailing throughout: barn doors, modern light fixtures, exposed beams, re-purposed wood, a designer's dream. Oversized master suite w/ walk in closet, and bonus space upstairs can be easily converted to an extra bedroom by choice. Enjoy tranquil living on one of the best private patios in town! Storage unit included. NO RENTAL RESTRICTIONS. Will not last!","Melissa Shaughnessy","(678) 644-4382"
"5835147","30308","Active","299900","Springdale Park","Inman","Grady","Amazing opportunity to own a 2/2 in the heart of Midtown! This sleek and stylish unit offers plenty of space, two large bedrooms with ample closet space and updated kitchens/bathrooms. Comes with 2 gated parking spots! Just steps to your favorite Midtown shops, restaurants, Piedmont Park, the Fox Theatre and MARTA. This historic building offers great amenities including a gym/pool. Two bedrooms for under $300,000 are rare these days so act quickly before this one goes away!","ADAM MORRISON","(404) 981-7249"
"5835545","30127","Active","299900","Varner","Tapp","McEachern","All That's Missing Is You!!  You must see this Fantastic Spacious Beauty on a Corner Lot in an expanding subdivision.  Gleaming Hardwood floors on the main level, Formal LR and DR as well as Gourmet Eat In kitchen. Guest Suite w/Full Bath rounds out the 1st floor.  Get lost in the huge Owner's suite complete with sitting room, Fireplace and Glamorous Owner's Bath. Detailed Molding throughout Main Level. Coffered Ceiling in Dining Room.  All appliances including washer and dryer remain!New interior and Exterior paint. Fully fenced backyard and Storage Building remains!","MONICA PAUL JOHNSON","(404) 271-0547"
"5836032","30360","Active","299900","Peachtree","Pinckneyville","Norcross","You can't beat the convenience of this popular Peachtree Corners / Dunwoody neighborhood with optional swim/tennis club.   This solid 4 sides brick ranch sits on a private park-like setting of large trees & natural plantings.  The home offers an open floor plan, gleaming hardwood floors, and abundance of windows filling it with natural light. Large kitchen with island /breakfast bar and tons of counter space & storage options.  Huge finished basement with family room, billiards, full bath, 2 additional rooms currently used as 4th & 5th bedrooms, screened porch & storage","MARY BETH MCLAUGHLIN","(404) 509-8767"
"5835844","30039","Active","299555","Partee","Shiloh","Shiloh","Most Popular Paran Homes Plan.  The Brooks: This beautifully designed plan is a 6 bedroom/4 full bath plan. It has a guest room on the main, and a Owners Suite upstairs with a master bath and separated tile shower, and garden tub, double vanities and walk in closet. Also, the upstairs includes 4 more spacious bedroom and 2 more full baths. The Kitchen includes SS appliances, including refrigerator, granite counter tops and 42 inch cabinets, with SS designer pulls. 5 inch wood floors; kitchen, breakfast, foyer and extended  foyer, downstairs hallway and dining room.","SHERRY AIMONETTI","(770) 298-6289"
"5835694","30024","Active","299000","Burnette","Hull","Peachtree Ridge","4 sides brick ranch w/finished basement in the sought after Peachtree Ridge school district. Main level has 4 bedroom/3 bathrooms, a brand new large deck perfect for entertaining. Finished basement has 2 bedrooms, a full kitchen and bathroom. A must see!","Rosa Scott","(678) 468-9372"
"5836687","30076","Active","298000","River Eves","Holcomb Bridge","Centennial","This is a private oasis amidst the energy and excitement that is Roswell.  A large kitchen opens to a family room with vaulted ceilings and a spacious formal living room.  Hardwood floors throughout the social areas and very large bedrooms.  The sun-lit finished terrace level has a large recreation area and an extra room that could be used as an office or as a library -- tons of storage space!  This spectacular home sits on a cul-de-sac lot.  Fast action in this neighborhood is a must!","ALINA  A JENKINS","(770) 998-2437"
"5834923","30040","Active","295000","Sawnee","Liberty - Forsyth","West Forsyth","Immaculate, just like new 4 BR 3 1/2 BA home with bedroom with bathroom on main level.  Entry foyer leads to 2 story great room with beautiful fireplace. Separate dining room, breakfast room, and kitchen with granite open to great room. Totally remodeled master BA has garden tub, seamless door glass oversize shower, double vanities, his and her closets.  Large master bedroom and two generous size secondary bedrooms with spacious closets.Garage entry if from alley in the back of the house. Award winning community built by Beazer with swim/tennis and excellent schools.","NANCY QUINN","(678) 451-5896"
"5835538","30076","Active","295000","Hembree Springs","Elkins Pointe","Roswell","Fantastic Home in the heart of Roswell! New hardwood floors and a beautiful backyard welcome you home.  Over-sized kitchen is perfect for entertaining with a fantastic sun-room off the breakfast area that opens to the level backyard.","Shari Sautner","(404) 668-8407"
"5831527","30043","Active","289900","Jackson - Gwinnett","Northbrook","Peachtree Ridge","Immaculately maintained Brick Traditional on a Private, Wooded 0.38 Acre Cul-de-sac lot!  Soaring two-story foyer w/wrought iron railings.  Oversized formal LR & DRs.  Site-finished hardwoods in foyer, kitchen & family room w/built-ins.  9' smooth ceilings.  White granite kitchen w/recessed lighting & gas cooktop views family room and has access to the oversized deck & fenced backyard.  Half bath w/furniture vanity.  Upstairs laundry w/sink.  Master suite w/WIC and updated tile bath.  One secondary BR connects to hall bath.  Full daylight basement for future expansion!","JASON  C MOORE","(678) 730-7200"
"5835583","30310","Active","289900","Tuskegee Airmen Global Academy","Brown","Booker T. Washington","This unique 2 story home has come to the market to provide a superb setting in Westview.  Live on ""The Ontarios"" and walk to the soon to be open Beltline!  Full of character, this renovated 3BR 2BA has hardwoods, new tile bathrooms, new kitchen with wood shaker cabinets, granite counters, and a full stainless appliance package including refrigerator.  Don't miss your opportunity!","JOHN W MANGHAM","(404) 872-1031"
"5835705","30102","Active","289900","Oak Grove - Cherokee","E.T. Booth","Etowah","Meticulously kept home in desirable Etowah District. Enjoy the large wooded backyard from secluded screen porch. Inlaw/ teen suite features an additional living area as well as a bedroom and bathroom all on one private level. Handscraped wood floors throughout the common area. Natural light abounds in the master and sitting room. Unwind in the fabulous remodeled master bath. Large kitchen is well appointed with hand glazed painted cabinets and stylish lighting! Basement is stubbed for bath. Could finish, or use as workshop/3rd garage! Owner/agent is licensed GA realtor.","Melanie Marsh","(770) 630-5559"
"5835758","30028","Active","289900","Matt","Liberty - Forsyth","West Forsyth","BEST PRICE IN NEIGHBORHOOD! Fabulous family home w/open floor plan on cul-de-sac street in Hunters Walk swim/tennis community! Wait until you see the wonderful living space&custom upgrades! Fabulous kitch cabinet space,granite,ss appl,brkfst bar,pantry&brkfst area. Oversized owner's retreat incl vaulted ceil,sitting area w/frplc&dual walk-in closets. Main lvl bdrm&full bath. Patio leads to flat,usable bckyrd-perfect for outdoor entertaining. Stone frplc, coffered ceil, wood floors! Close to parks, 400,shopping,schools,hospital&more. Up to $2000 in closing w/pref lender.","Cole Team","(770) 316-3110"
"5834969","30045","Active","289450","Starling","Couch","Grayson","Imagine coming home to this quiet cul de sac in this upscale swim/tennis neighborhood. This massive home sits on a 3/4 acre, beautifully wooded lot with a serene winding creek. Inside has the WOW factor featuring a grand 2 story foyer that leads to a gourmet kitchen, breakfast nook, and huge windows that let in lots of light. The upstairs master suite is clad with designer tile and polished granite. The jetted tub, walk-in closet, and vaulted ceilings will make getting ready each day feel like a dream come true. Includes Dining room, Bonus Room, Office, and Media Room","Jonathan Sieling","(404) 368-4719"
"5836011","30082","Active","289000","Russell - Cobb","Cobb - Other","South Cobb","Opportunity to live in highly desirable Barnes Mill Subdivision. Front door leads to open large foyer w/ trey ceiling.Beautiful 3 BEDRM 3.5 BA. Very spacious home w/ beautiful hardwood floors. Extra large kitchen w/ beautiful cabinets, granite counters SS appls, large island, pantry & french door to view beautiful landscaping. Relax in your own spa like master BA & retreat in large mater BDRM w/ sitting area. Private large deck. Gas stone fireplace perfect for cold nights. 1st FLR BDRM can be used as office, media, or extra living rm. 2 car garage offers addtl storage.","JILLISA HAMMONS","(404) 843-2500"
"5836386","30076","Active","286900","Sweet Apple","Elkins Pointe","Milton","You will know you have found your new home as you enter the foyer & stunning Great Room w/20 ft. ceilings.  Move in ready for you throughout!  A perfect place to entertain your friends in front of the tall fireplace or lead them outside the two French doors in the kitchen to a large, level, Fenced backyard.  Room to play and garden! Cooks kitchen w granite.  Dark hardwoods on main & all baths.  Large vaulted master bedrm.  2 NEW HVAC systems.  Great S/T neighborhood walkable to Sweet Apple Elem., Crabapple Park, Crabapple Village - Science/Technology Academy close by.","Martha W Chanaberry","(404) 229-8390"
"5835412","30680","Active","285900","County Line","Russell","Winder-Barrow","The Lucy plan offers function and space. The 4bd/3.5ba foyer opens to a spacious great room w/open concept breakfast nook and kitchen area.  The master on the main offers his & hers vanity, garden tub, separate shower and a large walk-in closet. The second floor has 3 bedrooms and 2 full baths as well as a media room that is perfect for entertaining guests or a game area for the kids.","Cook RES","(770) 540-6268"
"5835634","30144","Active","285000","Blackwell - Cobb","Daniell","Sprayberry","This is a fixer-upper sold as-is. Brand new roof (3 months old). Beautiful 5 bdrm/4bth that needs a little TLC. Loads of potential! separate in-law suite over garage. Large lot with in ground pool, two fireplaces - one in the kitchen and one in the family room. Great Swim community neighborhood with friendly neighbors. Motivated Seller, Bring all offers!!","Pamela Strada","(678) 521-5743"
